,event,event type,frequency,start time,end time,time segment,quasi case id,related object
0,high demand of: AlpenTech Innovations AG,hd,87,2023-08-12 14:36:23.044392505+00:00,2023-08-13 14:37:30.869158860+00:00,132,,AlpenTech Innovations AG
1,high demand of: Celtica Green Farms Oy,hd,106,2023-08-12 14:36:23.044392505+00:00,2023-08-13 14:37:30.869158860+00:00,132,,Celtica Green Farms Oy
2,high demand of: Baltic Wave Energies Ltd.,hd,88,2023-08-12 14:36:23.044392505+00:00,2023-08-13 14:37:30.869158860+00:00,132,,Baltic Wave Energies Ltd.
3,high demand of: Balkan Minerals d.o.o.,hd,78,2023-08-12 14:36:23.044392505+00:00,2023-08-13 14:37:30.869158860+00:00,132,,Balkan Minerals d.o.o.
4,high demand of: Riviera Robotics SAS,hd,88,2023-08-12 14:36:23.044392505+00:00,2023-08-13 14:37:30.869158860+00:00,132,,Riviera Robotics SAS
5,high demand of: Vesta Fashion House GmbH,hd,90,2023-08-12 14:36:23.044392505+00:00,2023-08-13 14:37:30.869158860+00:00,132,,Vesta Fashion House GmbH
6,high demand of: Eastern Oak Insurance Zrt.,hd,99,2023-08-12 14:36:23.044392505+00:00,2023-08-13 14:37:30.869158860+00:00,132,,Eastern Oak Insurance Zrt.
7,high demand of: SwissPeak Timepieces AG,hd,104,2023-08-12 14:36:23.044392505+00:00,2023-08-13 14:37:30.869158860+00:00,132,,SwissPeak Timepieces AG
8,high demand of: Mediterranea Luxury Cruises S.p.A.,hd,100,2023-08-12 14:36:23.044392505+00:00,2023-08-13 14:37:30.869158860+00:00,132,,Mediterranea Luxury Cruises S.p.A.
9,high demand of: Iberian Sun Solaridades SA,hd,98,2023-08-12 14:36:23.044392505+00:00,2023-08-13 14:37:30.869158860+00:00,132,,Iberian Sun Solaridades SA
10,high demand of: Nordica Systems GmbH,hd,91,2023-08-12 14:36:23.044392505+00:00,2023-08-13 14:37:30.869158860+00:00,132,,Nordica Systems GmbH
11,high demand of: Golden Fleece Textiles S.A.R.L.,hd,113,2023-08-12 14:36:23.044392505+00:00,2023-08-13 14:37:30.869158860+00:00,132,,Golden Fleece Textiles S.A.R.L.
12,high demand of: Pantheon Art Gallery Kft.,hd,91,2023-08-12 14:36:23.044392505+00:00,2023-08-13 14:37:30.869158860+00:00,132,,Pantheon Art Gallery Kft.
13,high demand of: Carpathian Financial Services plc,hd,84,2023-08-12 14:36:23.044392505+00:00,2023-08-13 14:37:30.869158860+00:00,132,,Carpathian Financial Services plc
14,high demand of: Danube Pharmaceuticals BV,hd,55,2023-08-12 14:36:23.044392505+00:00,2023-08-13 14:37:30.869158860+00:00,132,,Danube Pharmaceuticals BV
15,high demand of: Leah Tacke genannt Unterberg,hd,640,2023-08-12 14:36:23.044392505+00:00,2023-08-13 14:37:30.869158860+00:00,132,,Leah Tacke genannt Unterberg
16,high demand of: Benedikt Knopp,hd,650,2023-08-12 14:36:23.044392505+00:00,2023-08-13 14:37:30.869158860+00:00,132,,Benedikt Knopp
17,high demand of: Christopher Schwanen,hd,637,2023-08-12 14:36:23.044392505+00:00,2023-08-13 14:37:30.869158860+00:00,132,,Christopher Schwanen
18,high demand of: Istvan Koren,hd,153,2023-08-12 14:36:23.044392505+00:00,2023-08-13 14:37:30.869158860+00:00,132,,Istvan Koren
19,high demand of: Nina Graves,hd,631,2023-08-12 14:36:23.044392505+00:00,2023-08-13 14:37:30.869158860+00:00,132,,Nina Graves
20,high demand of: Wil van der Aalst,hd,163,2023-08-12 14:36:23.044392505+00:00,2023-08-13 14:37:30.869158860+00:00,132,,Wil van der Aalst
21,high demand of: Marco Pegoraro,hd,670,2023-08-12 14:36:23.044392505+00:00,2023-08-13 14:37:30.869158860+00:00,132,,Marco Pegoraro
22,high demand of: Mahsa Bafrani,hd,647,2023-08-12 14:36:23.044392505+00:00,2023-08-13 14:37:30.869158860+00:00,132,,Mahsa Bafrani
23,high demand of: Detlef Wetzeler,hd,584,2023-08-12 14:36:23.044392505+00:00,2023-08-13 14:37:30.869158860+00:00,132,,Detlef Wetzeler
24,high demand of: Mara Nitschke,hd,112,2023-08-12 14:36:23.044392505+00:00,2023-08-13 14:37:30.869158860+00:00,132,,Mara Nitschke
25,high demand of: Jan Niklas Adams,hd,94,2023-08-12 14:36:23.044392505+00:00,2023-08-13 14:37:30.869158860+00:00,132,,Jan Niklas Adams
26,high demand of: Christine von Dobbert,hd,159,2023-08-12 14:36:23.044392505+00:00,2023-08-13 14:37:30.869158860+00:00,132,,Christine von Dobbert
27,high demand of: Viki Peeva,hd,146,2023-08-12 14:36:23.044392505+00:00,2023-08-13 14:37:30.869158860+00:00,132,,Viki Peeva
28,high demand of: Eduardo Goulart Rocha,hd,159,2023-08-12 14:36:23.044392505+00:00,2023-08-13 14:37:30.869158860+00:00,132,,Eduardo Goulart Rocha
29,high demand of: Majid Rafiei,hd,121,2023-08-12 14:36:23.044392505+00:00,2023-08-13 14:37:30.869158860+00:00,132,,Majid Rafiei
30,high demand of: Yisong Zhang,hd,117,2023-08-12 14:36:23.044392505+00:00,2023-08-13 14:37:30.869158860+00:00,132,,Yisong Zhang
31,high demand of: Alessandro Berti,hd,164,2023-08-12 14:36:23.044392505+00:00,2023-08-13 14:37:30.869158860+00:00,132,,Alessandro Berti
32,high demand of: Gyunam Park,hd,167,2023-08-12 14:36:23.044392505+00:00,2023-08-13 14:37:30.869158860+00:00,132,,Gyunam Park
33,high demand of: Echo,hd,910,2023-08-12 14:36:23.044392505+00:00,2023-08-13 14:37:30.869158860+00:00,132,,Echo
34,high demand of: iPhone 11 Pro,hd,924,2023-08-12 14:36:23.044392505+00:00,2023-08-13 14:37:30.869158860+00:00,132,,iPhone 11 Pro
35,high demand of: Kindle Paperwhite,hd,1018,2023-08-12 14:36:23.044392505+00:00,2023-08-13 14:37:30.869158860+00:00,132,,Kindle Paperwhite
36,high demand of: MacBook Pro,hd,929,2023-08-12 14:36:23.044392505+00:00,2023-08-13 14:37:30.869158860+00:00,132,,MacBook Pro
37,high demand of: iPad mini,hd,889,2023-08-12 14:36:23.044392505+00:00,2023-08-13 14:37:30.869158860+00:00,132,,iPad mini
38,high demand of: Fire Stick,hd,1132,2023-08-12 14:36:23.044392505+00:00,2023-08-13 14:37:30.869158860+00:00,132,,Fire Stick
39,high demand of: iPad Pro,hd,1024,2023-08-12 14:36:23.044392505+00:00,2023-08-13 14:37:30.869158860+00:00,132,,iPad Pro
40,high demand of: iPhone 8,hd,957,2023-08-12 14:36:23.044392505+00:00,2023-08-13 14:37:30.869158860+00:00,132,,iPhone 8
41,high demand of: iPhone X,hd,883,2023-08-12 14:36:23.044392505+00:00,2023-08-13 14:37:30.869158860+00:00,132,,iPhone X
42,high demand of: Echo Dot,hd,808,2023-08-12 14:36:23.044392505+00:00,2023-08-13 14:37:30.869158860+00:00,132,,Echo Dot
43,high demand of: Echo Show 8,hd,995,2023-08-12 14:36:23.044392505+00:00,2023-08-13 14:37:30.869158860+00:00,132,,Echo Show 8
44,high demand of: Fire Stick 4K,hd,1023,2023-08-12 14:36:23.044392505+00:00,2023-08-13 14:37:30.869158860+00:00,132,,Fire Stick 4K
45,high demand of: Echo Studio,hd,862,2023-08-12 14:36:23.044392505+00:00,2023-08-13 14:37:30.869158860+00:00,132,,Echo Studio
46,high demand of: MacBook Air,hd,887,2023-08-12 14:36:23.044392505+00:00,2023-08-13 14:37:30.869158860+00:00,132,,MacBook Air
47,high demand of: iPad Air,hd,937,2023-08-12 14:36:23.044392505+00:00,2023-08-13 14:37:30.869158860+00:00,132,,iPad Air
48,high demand of: Echo Show 5,hd,820,2023-08-12 14:36:23.044392505+00:00,2023-08-13 14:37:30.869158860+00:00,132,,Echo Show 5
49,high demand of: iPad,hd,905,2023-08-12 14:36:23.044392505+00:00,2023-08-13 14:37:30.869158860+00:00,132,,iPad
50,high demand of: iPhone 11,hd,879,2023-08-12 14:36:23.044392505+00:00,2023-08-13 14:37:30.869158860+00:00,132,,iPhone 11
51,high demand of: Echo Plus,hd,936,2023-08-12 14:36:23.044392505+00:00,2023-08-13 14:37:30.869158860+00:00,132,,Echo Plus
52,high demand of: Kindle,hd,825,2023-08-12 14:36:23.044392505+00:00,2023-08-13 14:37:30.869158860+00:00,132,,Kindle
53,high load of object type items,hl,20757,2023-08-12 14:36:23.044392505+00:00,2023-08-13 14:37:30.869158860+00:00,132,,items
54,high load of object type orders,hl,2129,2023-08-12 14:36:23.044392505+00:00,2023-08-13 14:37:30.869158860+00:00,132,,orders
55,high load of object type packages,hl,1210,2023-08-12 14:36:23.044392505+00:00,2023-08-13 14:37:30.869158860+00:00,132,,packages
56,high load (over all object types),hol,7095,2023-08-12 14:36:23.044392505+00:00,2023-08-13 14:37:30.869158860+00:00,132,,
