,event,event type,frequency,start time,end time,time segment,quasi case id,related object
0,high demand of: AlpenTech Innovations AG,hd,56,2023-07-03 13:51:10.053738305+00:00,2023-07-04 13:52:17.878504660+00:00,92,,AlpenTech Innovations AG
1,high demand of: Celtica Green Farms Oy,hd,71,2023-07-03 13:51:10.053738305+00:00,2023-07-04 13:52:17.878504660+00:00,92,,Celtica Green Farms Oy
2,high demand of: Baltic Wave Energies Ltd.,hd,60,2023-07-03 13:51:10.053738305+00:00,2023-07-04 13:52:17.878504660+00:00,92,,Baltic Wave Energies Ltd.
3,high demand of: Balkan Minerals d.o.o.,hd,40,2023-07-03 13:51:10.053738305+00:00,2023-07-04 13:52:17.878504660+00:00,92,,Balkan Minerals d.o.o.
4,high demand of: Riviera Robotics SAS,hd,62,2023-07-03 13:51:10.053738305+00:00,2023-07-04 13:52:17.878504660+00:00,92,,Riviera Robotics SAS
5,high demand of: Vesta Fashion House GmbH,hd,50,2023-07-03 13:51:10.053738305+00:00,2023-07-04 13:52:17.878504660+00:00,92,,Vesta Fashion House GmbH
6,high demand of: Eastern Oak Insurance Zrt.,hd,68,2023-07-03 13:51:10.053738305+00:00,2023-07-04 13:52:17.878504660+00:00,92,,Eastern Oak Insurance Zrt.
7,high demand of: SwissPeak Timepieces AG,hd,84,2023-07-03 13:51:10.053738305+00:00,2023-07-04 13:52:17.878504660+00:00,92,,SwissPeak Timepieces AG
8,high demand of: Mediterranea Luxury Cruises S.p.A.,hd,73,2023-07-03 13:51:10.053738305+00:00,2023-07-04 13:52:17.878504660+00:00,92,,Mediterranea Luxury Cruises S.p.A.
9,high demand of: Iberian Sun Solaridades SA,hd,72,2023-07-03 13:51:10.053738305+00:00,2023-07-04 13:52:17.878504660+00:00,92,,Iberian Sun Solaridades SA
10,high demand of: Nordica Systems GmbH,hd,60,2023-07-03 13:51:10.053738305+00:00,2023-07-04 13:52:17.878504660+00:00,92,,Nordica Systems GmbH
11,high demand of: Golden Fleece Textiles S.A.R.L.,hd,65,2023-07-03 13:51:10.053738305+00:00,2023-07-04 13:52:17.878504660+00:00,92,,Golden Fleece Textiles S.A.R.L.
12,high demand of: Pantheon Art Gallery Kft.,hd,57,2023-07-03 13:51:10.053738305+00:00,2023-07-04 13:52:17.878504660+00:00,92,,Pantheon Art Gallery Kft.
13,high demand of: Carpathian Financial Services plc,hd,58,2023-07-03 13:51:10.053738305+00:00,2023-07-04 13:52:17.878504660+00:00,92,,Carpathian Financial Services plc
14,high demand of: Danube Pharmaceuticals BV,hd,36,2023-07-03 13:51:10.053738305+00:00,2023-07-04 13:52:17.878504660+00:00,92,,Danube Pharmaceuticals BV
15,high demand of: Leah Tacke genannt Unterberg,hd,429,2023-07-03 13:51:10.053738305+00:00,2023-07-04 13:52:17.878504660+00:00,92,,Leah Tacke genannt Unterberg
16,high demand of: Benedikt Knopp,hd,424,2023-07-03 13:51:10.053738305+00:00,2023-07-04 13:52:17.878504660+00:00,92,,Benedikt Knopp
17,high demand of: Christopher Schwanen,hd,433,2023-07-03 13:51:10.053738305+00:00,2023-07-04 13:52:17.878504660+00:00,92,,Christopher Schwanen
18,high demand of: Istvan Koren,hd,105,2023-07-03 13:51:10.053738305+00:00,2023-07-04 13:52:17.878504660+00:00,92,,Istvan Koren
19,high demand of: Nina Graves,hd,433,2023-07-03 13:51:10.053738305+00:00,2023-07-04 13:52:17.878504660+00:00,92,,Nina Graves
20,high demand of: Wil van der Aalst,hd,108,2023-07-03 13:51:10.053738305+00:00,2023-07-04 13:52:17.878504660+00:00,92,,Wil van der Aalst
21,high demand of: Marco Pegoraro,hd,451,2023-07-03 13:51:10.053738305+00:00,2023-07-04 13:52:17.878504660+00:00,92,,Marco Pegoraro
22,high demand of: Mahsa Bafrani,hd,441,2023-07-03 13:51:10.053738305+00:00,2023-07-04 13:52:17.878504660+00:00,92,,Mahsa Bafrani
23,high demand of: Detlef Wetzeler,hd,394,2023-07-03 13:51:10.053738305+00:00,2023-07-04 13:52:17.878504660+00:00,92,,Detlef Wetzeler
24,high demand of: Mara Nitschke,hd,71,2023-07-03 13:51:10.053738305+00:00,2023-07-04 13:52:17.878504660+00:00,92,,Mara Nitschke
25,high demand of: Jan Niklas Adams,hd,60,2023-07-03 13:51:10.053738305+00:00,2023-07-04 13:52:17.878504660+00:00,92,,Jan Niklas Adams
26,high demand of: Christine von Dobbert,hd,108,2023-07-03 13:51:10.053738305+00:00,2023-07-04 13:52:17.878504660+00:00,92,,Christine von Dobbert
27,high demand of: Viki Peeva,hd,97,2023-07-03 13:51:10.053738305+00:00,2023-07-04 13:52:17.878504660+00:00,92,,Viki Peeva
28,high demand of: Eduardo Goulart Rocha,hd,92,2023-07-03 13:51:10.053738305+00:00,2023-07-04 13:52:17.878504660+00:00,92,,Eduardo Goulart Rocha
29,high demand of: Majid Rafiei,hd,95,2023-07-03 13:51:10.053738305+00:00,2023-07-04 13:52:17.878504660+00:00,92,,Majid Rafiei
30,high demand of: Yisong Zhang,hd,70,2023-07-03 13:51:10.053738305+00:00,2023-07-04 13:52:17.878504660+00:00,92,,Yisong Zhang
31,high demand of: Alessandro Berti,hd,120,2023-07-03 13:51:10.053738305+00:00,2023-07-04 13:52:17.878504660+00:00,92,,Alessandro Berti
32,high demand of: Gyunam Park,hd,108,2023-07-03 13:51:10.053738305+00:00,2023-07-04 13:52:17.878504660+00:00,92,,Gyunam Park
33,high demand of: Echo,hd,570,2023-07-03 13:51:10.053738305+00:00,2023-07-04 13:52:17.878504660+00:00,92,,Echo
34,high demand of: iPhone 11 Pro,hd,610,2023-07-03 13:51:10.053738305+00:00,2023-07-04 13:52:17.878504660+00:00,92,,iPhone 11 Pro
35,high demand of: Kindle Paperwhite,hd,692,2023-07-03 13:51:10.053738305+00:00,2023-07-04 13:52:17.878504660+00:00,92,,Kindle Paperwhite
36,high demand of: MacBook Pro,hd,599,2023-07-03 13:51:10.053738305+00:00,2023-07-04 13:52:17.878504660+00:00,92,,MacBook Pro
37,high demand of: iPad mini,hd,603,2023-07-03 13:51:10.053738305+00:00,2023-07-04 13:52:17.878504660+00:00,92,,iPad mini
38,high demand of: Fire Stick,hd,786,2023-07-03 13:51:10.053738305+00:00,2023-07-04 13:52:17.878504660+00:00,92,,Fire Stick
39,high demand of: iPad Pro,hd,692,2023-07-03 13:51:10.053738305+00:00,2023-07-04 13:52:17.878504660+00:00,92,,iPad Pro
40,high demand of: iPhone 8,hd,698,2023-07-03 13:51:10.053738305+00:00,2023-07-04 13:52:17.878504660+00:00,92,,iPhone 8
41,high demand of: iPhone X,hd,585,2023-07-03 13:51:10.053738305+00:00,2023-07-04 13:52:17.878504660+00:00,92,,iPhone X
42,high demand of: Echo Dot,hd,514,2023-07-03 13:51:10.053738305+00:00,2023-07-04 13:52:17.878504660+00:00,92,,Echo Dot
43,high demand of: Echo Show 8,hd,683,2023-07-03 13:51:10.053738305+00:00,2023-07-04 13:52:17.878504660+00:00,92,,Echo Show 8
44,high demand of: Fire Stick 4K,hd,732,2023-07-03 13:51:10.053738305+00:00,2023-07-04 13:52:17.878504660+00:00,92,,Fire Stick 4K
45,high demand of: Echo Studio,hd,607,2023-07-03 13:51:10.053738305+00:00,2023-07-04 13:52:17.878504660+00:00,92,,Echo Studio
46,high demand of: MacBook Air,hd,561,2023-07-03 13:51:10.053738305+00:00,2023-07-04 13:52:17.878504660+00:00,92,,MacBook Air
47,high demand of: iPad Air,hd,588,2023-07-03 13:51:10.053738305+00:00,2023-07-04 13:52:17.878504660+00:00,92,,iPad Air
48,high demand of: Echo Show 5,hd,459,2023-07-03 13:51:10.053738305+00:00,2023-07-04 13:52:17.878504660+00:00,92,,Echo Show 5
49,high demand of: iPad,hd,598,2023-07-03 13:51:10.053738305+00:00,2023-07-04 13:52:17.878504660+00:00,92,,iPad
50,high demand of: iPhone 11,hd,542,2023-07-03 13:51:10.053738305+00:00,2023-07-04 13:52:17.878504660+00:00,92,,iPhone 11
51,high demand of: Echo Plus,hd,615,2023-07-03 13:51:10.053738305+00:00,2023-07-04 13:52:17.878504660+00:00,92,,Echo Plus
52,high demand of: Kindle,hd,527,2023-07-03 13:51:10.053738305+00:00,2023-07-04 13:52:17.878504660+00:00,92,,Kindle
53,high load of object type items,hl,13697,2023-07-03 13:51:10.053738305+00:00,2023-07-04 13:52:17.878504660+00:00,92,,items
54,high load of object type orders,hl,1369,2023-07-03 13:51:10.053738305+00:00,2023-07-04 13:52:17.878504660+00:00,92,,orders
55,high load of object type packages,hl,803,2023-07-03 13:51:10.053738305+00:00,2023-07-04 13:52:17.878504660+00:00,92,,packages
56,high load (over all object types),hol,4713,2023-07-03 13:51:10.053738305+00:00,2023-07-04 13:52:17.878504660+00:00,92,,
