,event,event type,frequency,start time,end time,time segment,quasi case id,related object
0,high demand of: AlpenTech Innovations AG,hd,207,2024-01-19 17:37:15.007009305+00:00,2024-01-20 17:38:22.831775660+00:00,292,,AlpenTech Innovations AG
1,high demand of: Celtica Green Farms Oy,hd,235,2024-01-19 17:37:15.007009305+00:00,2024-01-20 17:38:22.831775660+00:00,292,,Celtica Green Farms Oy
2,high demand of: Baltic Wave Energies Ltd.,hd,226,2024-01-19 17:37:15.007009305+00:00,2024-01-20 17:38:22.831775660+00:00,292,,Baltic Wave Energies Ltd.
3,high demand of: Balkan Minerals d.o.o.,hd,244,2024-01-19 17:37:15.007009305+00:00,2024-01-20 17:38:22.831775660+00:00,292,,Balkan Minerals d.o.o.
4,high demand of: Riviera Robotics SAS,hd,240,2024-01-19 17:37:15.007009305+00:00,2024-01-20 17:38:22.831775660+00:00,292,,Riviera Robotics SAS
5,high demand of: Vesta Fashion House GmbH,hd,191,2024-01-19 17:37:15.007009305+00:00,2024-01-20 17:38:22.831775660+00:00,292,,Vesta Fashion House GmbH
6,high demand of: Eastern Oak Insurance Zrt.,hd,222,2024-01-19 17:37:15.007009305+00:00,2024-01-20 17:38:22.831775660+00:00,292,,Eastern Oak Insurance Zrt.
7,high demand of: SwissPeak Timepieces AG,hd,241,2024-01-19 17:37:15.007009305+00:00,2024-01-20 17:38:22.831775660+00:00,292,,SwissPeak Timepieces AG
8,high demand of: Mediterranea Luxury Cruises S.p.A.,hd,214,2024-01-19 17:37:15.007009305+00:00,2024-01-20 17:38:22.831775660+00:00,292,,Mediterranea Luxury Cruises S.p.A.
9,high demand of: Iberian Sun Solaridades SA,hd,216,2024-01-19 17:37:15.007009305+00:00,2024-01-20 17:38:22.831775660+00:00,292,,Iberian Sun Solaridades SA
10,high demand of: Nordica Systems GmbH,hd,190,2024-01-19 17:37:15.007009305+00:00,2024-01-20 17:38:22.831775660+00:00,292,,Nordica Systems GmbH
11,high demand of: Golden Fleece Textiles S.A.R.L.,hd,249,2024-01-19 17:37:15.007009305+00:00,2024-01-20 17:38:22.831775660+00:00,292,,Golden Fleece Textiles S.A.R.L.
12,high demand of: Pantheon Art Gallery Kft.,hd,208,2024-01-19 17:37:15.007009305+00:00,2024-01-20 17:38:22.831775660+00:00,292,,Pantheon Art Gallery Kft.
13,high demand of: Carpathian Financial Services plc,hd,214,2024-01-19 17:37:15.007009305+00:00,2024-01-20 17:38:22.831775660+00:00,292,,Carpathian Financial Services plc
14,high demand of: Danube Pharmaceuticals BV,hd,167,2024-01-19 17:37:15.007009305+00:00,2024-01-20 17:38:22.831775660+00:00,292,,Danube Pharmaceuticals BV
15,high demand of: Leah Tacke genannt Unterberg,hd,1508,2024-01-19 17:37:15.007009305+00:00,2024-01-20 17:38:22.831775660+00:00,292,,Leah Tacke genannt Unterberg
16,high demand of: Benedikt Knopp,hd,1547,2024-01-19 17:37:15.007009305+00:00,2024-01-20 17:38:22.831775660+00:00,292,,Benedikt Knopp
17,high demand of: Christopher Schwanen,hd,1486,2024-01-19 17:37:15.007009305+00:00,2024-01-20 17:38:22.831775660+00:00,292,,Christopher Schwanen
18,high demand of: Istvan Koren,hd,366,2024-01-19 17:37:15.007009305+00:00,2024-01-20 17:38:22.831775660+00:00,292,,Istvan Koren
19,high demand of: Nina Graves,hd,1499,2024-01-19 17:37:15.007009305+00:00,2024-01-20 17:38:22.831775660+00:00,292,,Nina Graves
20,high demand of: Wil van der Aalst,hd,377,2024-01-19 17:37:15.007009305+00:00,2024-01-20 17:38:22.831775660+00:00,292,,Wil van der Aalst
21,high demand of: Marco Pegoraro,hd,1584,2024-01-19 17:37:15.007009305+00:00,2024-01-20 17:38:22.831775660+00:00,292,,Marco Pegoraro
22,high demand of: Mahsa Bafrani,hd,1594,2024-01-19 17:37:15.007009305+00:00,2024-01-20 17:38:22.831775660+00:00,292,,Mahsa Bafrani
23,high demand of: Detlef Wetzeler,hd,1451,2024-01-19 17:37:15.007009305+00:00,2024-01-20 17:38:22.831775660+00:00,292,,Detlef Wetzeler
24,high demand of: Mara Nitschke,hd,251,2024-01-19 17:37:15.007009305+00:00,2024-01-20 17:38:22.831775660+00:00,292,,Mara Nitschke
25,high demand of: Jan Niklas Adams,hd,213,2024-01-19 17:37:15.007009305+00:00,2024-01-20 17:38:22.831775660+00:00,292,,Jan Niklas Adams
26,high demand of: Christine von Dobbert,hd,422,2024-01-19 17:37:15.007009305+00:00,2024-01-20 17:38:22.831775660+00:00,292,,Christine von Dobbert
27,high demand of: Viki Peeva,hd,329,2024-01-19 17:37:15.007009305+00:00,2024-01-20 17:38:22.831775660+00:00,292,,Viki Peeva
28,high demand of: Eduardo Goulart Rocha,hd,367,2024-01-19 17:37:15.007009305+00:00,2024-01-20 17:38:22.831775660+00:00,292,,Eduardo Goulart Rocha
29,high demand of: Majid Rafiei,hd,332,2024-01-19 17:37:15.007009305+00:00,2024-01-20 17:38:22.831775660+00:00,292,,Majid Rafiei
30,high demand of: Yisong Zhang,hd,346,2024-01-19 17:37:15.007009305+00:00,2024-01-20 17:38:22.831775660+00:00,292,,Yisong Zhang
31,high demand of: Alessandro Berti,hd,428,2024-01-19 17:37:15.007009305+00:00,2024-01-20 17:38:22.831775660+00:00,292,,Alessandro Berti
32,high demand of: Gyunam Park,hd,357,2024-01-19 17:37:15.007009305+00:00,2024-01-20 17:38:22.831775660+00:00,292,,Gyunam Park
33,high demand of: Echo,hd,2168,2024-01-19 17:37:15.007009305+00:00,2024-01-20 17:38:22.831775660+00:00,292,,Echo
34,high demand of: iPhone 11 Pro,hd,2219,2024-01-19 17:37:15.007009305+00:00,2024-01-20 17:38:22.831775660+00:00,292,,iPhone 11 Pro
35,high demand of: Kindle Paperwhite,hd,2273,2024-01-19 17:37:15.007009305+00:00,2024-01-20 17:38:22.831775660+00:00,292,,Kindle Paperwhite
36,high demand of: MacBook Pro,hd,2230,2024-01-19 17:37:15.007009305+00:00,2024-01-20 17:38:22.831775660+00:00,292,,MacBook Pro
37,high demand of: iPad mini,hd,2064,2024-01-19 17:37:15.007009305+00:00,2024-01-20 17:38:22.831775660+00:00,292,,iPad mini
38,high demand of: Fire Stick,hd,2412,2024-01-19 17:37:15.007009305+00:00,2024-01-20 17:38:22.831775660+00:00,292,,Fire Stick
39,high demand of: iPad Pro,hd,2368,2024-01-19 17:37:15.007009305+00:00,2024-01-20 17:38:22.831775660+00:00,292,,iPad Pro
40,high demand of: iPhone 8,hd,2372,2024-01-19 17:37:15.007009305+00:00,2024-01-20 17:38:22.831775660+00:00,292,,iPhone 8
41,high demand of: iPhone X,hd,2428,2024-01-19 17:37:15.007009305+00:00,2024-01-20 17:38:22.831775660+00:00,292,,iPhone X
42,high demand of: Echo Dot,hd,2229,2024-01-19 17:37:15.007009305+00:00,2024-01-20 17:38:22.831775660+00:00,292,,Echo Dot
43,high demand of: Echo Show 8,hd,2259,2024-01-19 17:37:15.007009305+00:00,2024-01-20 17:38:22.831775660+00:00,292,,Echo Show 8
44,high demand of: Fire Stick 4K,hd,2291,2024-01-19 17:37:15.007009305+00:00,2024-01-20 17:38:22.831775660+00:00,292,,Fire Stick 4K
45,high demand of: Echo Studio,hd,2266,2024-01-19 17:37:15.007009305+00:00,2024-01-20 17:38:22.831775660+00:00,292,,Echo Studio
46,high demand of: MacBook Air,hd,2215,2024-01-19 17:37:15.007009305+00:00,2024-01-20 17:38:22.831775660+00:00,292,,MacBook Air
47,high demand of: iPad Air,hd,2366,2024-01-19 17:37:15.007009305+00:00,2024-01-20 17:38:22.831775660+00:00,292,,iPad Air
48,high demand of: Echo Show 5,hd,2224,2024-01-19 17:37:15.007009305+00:00,2024-01-20 17:38:22.831775660+00:00,292,,Echo Show 5
49,high demand of: iPad,hd,2216,2024-01-19 17:37:15.007009305+00:00,2024-01-20 17:38:22.831775660+00:00,292,,iPad
50,high demand of: iPhone 11,hd,2021,2024-01-19 17:37:15.007009305+00:00,2024-01-20 17:38:22.831775660+00:00,292,,iPhone 11
51,high demand of: Echo Plus,hd,2290,2024-01-19 17:37:15.007009305+00:00,2024-01-20 17:38:22.831775660+00:00,292,,Echo Plus
52,high demand of: Kindle,hd,1923,2024-01-19 17:37:15.007009305+00:00,2024-01-20 17:38:22.831775660+00:00,292,,Kindle
53,high load of object type items,hl,49926,2024-01-19 17:37:15.007009305+00:00,2024-01-20 17:38:22.831775660+00:00,292,,items
54,high load of object type orders,hl,5256,2024-01-19 17:37:15.007009305+00:00,2024-01-20 17:38:22.831775660+00:00,292,,orders
55,high load of object type packages,hl,2978,2024-01-19 17:37:15.007009305+00:00,2024-01-20 17:38:22.831775660+00:00,292,,packages
56,high load (over all object types),hol,17173,2024-01-19 17:37:15.007009305+00:00,2024-01-20 17:38:22.831775660+00:00,292,,
