,event,event type,frequency,start time,end time,time segment,quasi case id,related object
0,high demand of: AlpenTech Innovations AG,hd,176,2023-11-28 16:38:28.119158845+00:00,2023-11-29 16:39:35.943925200+00:00,240,,AlpenTech Innovations AG
1,high demand of: Celtica Green Farms Oy,hd,195,2023-11-28 16:38:28.119158845+00:00,2023-11-29 16:39:35.943925200+00:00,240,,Celtica Green Farms Oy
2,high demand of: Baltic Wave Energies Ltd.,hd,190,2023-11-28 16:38:28.119158845+00:00,2023-11-29 16:39:35.943925200+00:00,240,,Baltic Wave Energies Ltd.
3,high demand of: Balkan Minerals d.o.o.,hd,187,2023-11-28 16:38:28.119158845+00:00,2023-11-29 16:39:35.943925200+00:00,240,,Balkan Minerals d.o.o.
4,high demand of: Riviera Robotics SAS,hd,190,2023-11-28 16:38:28.119158845+00:00,2023-11-29 16:39:35.943925200+00:00,240,,Riviera Robotics SAS
5,high demand of: Vesta Fashion House GmbH,hd,161,2023-11-28 16:38:28.119158845+00:00,2023-11-29 16:39:35.943925200+00:00,240,,Vesta Fashion House GmbH
6,high demand of: Eastern Oak Insurance Zrt.,hd,176,2023-11-28 16:38:28.119158845+00:00,2023-11-29 16:39:35.943925200+00:00,240,,Eastern Oak Insurance Zrt.
7,high demand of: SwissPeak Timepieces AG,hd,214,2023-11-28 16:38:28.119158845+00:00,2023-11-29 16:39:35.943925200+00:00,240,,SwissPeak Timepieces AG
8,high demand of: Mediterranea Luxury Cruises S.p.A.,hd,176,2023-11-28 16:38:28.119158845+00:00,2023-11-29 16:39:35.943925200+00:00,240,,Mediterranea Luxury Cruises S.p.A.
9,high demand of: Iberian Sun Solaridades SA,hd,182,2023-11-28 16:38:28.119158845+00:00,2023-11-29 16:39:35.943925200+00:00,240,,Iberian Sun Solaridades SA
10,high demand of: Nordica Systems GmbH,hd,156,2023-11-28 16:38:28.119158845+00:00,2023-11-29 16:39:35.943925200+00:00,240,,Nordica Systems GmbH
11,high demand of: Golden Fleece Textiles S.A.R.L.,hd,199,2023-11-28 16:38:28.119158845+00:00,2023-11-29 16:39:35.943925200+00:00,240,,Golden Fleece Textiles S.A.R.L.
12,high demand of: Pantheon Art Gallery Kft.,hd,169,2023-11-28 16:38:28.119158845+00:00,2023-11-29 16:39:35.943925200+00:00,240,,Pantheon Art Gallery Kft.
13,high demand of: Carpathian Financial Services plc,hd,160,2023-11-28 16:38:28.119158845+00:00,2023-11-29 16:39:35.943925200+00:00,240,,Carpathian Financial Services plc
14,high demand of: Danube Pharmaceuticals BV,hd,132,2023-11-28 16:38:28.119158845+00:00,2023-11-29 16:39:35.943925200+00:00,240,,Danube Pharmaceuticals BV
15,high demand of: Leah Tacke genannt Unterberg,hd,1241,2023-11-28 16:38:28.119158845+00:00,2023-11-29 16:39:35.943925200+00:00,240,,Leah Tacke genannt Unterberg
16,high demand of: Benedikt Knopp,hd,1250,2023-11-28 16:38:28.119158845+00:00,2023-11-29 16:39:35.943925200+00:00,240,,Benedikt Knopp
17,high demand of: Christopher Schwanen,hd,1219,2023-11-28 16:38:28.119158845+00:00,2023-11-29 16:39:35.943925200+00:00,240,,Christopher Schwanen
18,high demand of: Istvan Koren,hd,296,2023-11-28 16:38:28.119158845+00:00,2023-11-29 16:39:35.943925200+00:00,240,,Istvan Koren
19,high demand of: Nina Graves,hd,1244,2023-11-28 16:38:28.119158845+00:00,2023-11-29 16:39:35.943925200+00:00,240,,Nina Graves
20,high demand of: Wil van der Aalst,hd,310,2023-11-28 16:38:28.119158845+00:00,2023-11-29 16:39:35.943925200+00:00,240,,Wil van der Aalst
21,high demand of: Marco Pegoraro,hd,1296,2023-11-28 16:38:28.119158845+00:00,2023-11-29 16:39:35.943925200+00:00,240,,Marco Pegoraro
22,high demand of: Mahsa Bafrani,hd,1307,2023-11-28 16:38:28.119158845+00:00,2023-11-29 16:39:35.943925200+00:00,240,,Mahsa Bafrani
23,high demand of: Detlef Wetzeler,hd,1170,2023-11-28 16:38:28.119158845+00:00,2023-11-29 16:39:35.943925200+00:00,240,,Detlef Wetzeler
24,high demand of: Mara Nitschke,hd,201,2023-11-28 16:38:28.119158845+00:00,2023-11-29 16:39:35.943925200+00:00,240,,Mara Nitschke
25,high demand of: Jan Niklas Adams,hd,175,2023-11-28 16:38:28.119158845+00:00,2023-11-29 16:39:35.943925200+00:00,240,,Jan Niklas Adams
26,high demand of: Christine von Dobbert,hd,347,2023-11-28 16:38:28.119158845+00:00,2023-11-29 16:39:35.943925200+00:00,240,,Christine von Dobbert
27,high demand of: Viki Peeva,hd,274,2023-11-28 16:38:28.119158845+00:00,2023-11-29 16:39:35.943925200+00:00,240,,Viki Peeva
28,high demand of: Eduardo Goulart Rocha,hd,299,2023-11-28 16:38:28.119158845+00:00,2023-11-29 16:39:35.943925200+00:00,240,,Eduardo Goulart Rocha
29,high demand of: Majid Rafiei,hd,269,2023-11-28 16:38:28.119158845+00:00,2023-11-29 16:39:35.943925200+00:00,240,,Majid Rafiei
30,high demand of: Yisong Zhang,hd,276,2023-11-28 16:38:28.119158845+00:00,2023-11-29 16:39:35.943925200+00:00,240,,Yisong Zhang
31,high demand of: Alessandro Berti,hd,350,2023-11-28 16:38:28.119158845+00:00,2023-11-29 16:39:35.943925200+00:00,240,,Alessandro Berti
32,high demand of: Gyunam Park,hd,296,2023-11-28 16:38:28.119158845+00:00,2023-11-29 16:39:35.943925200+00:00,240,,Gyunam Park
33,high demand of: Echo,hd,1776,2023-11-28 16:38:28.119158845+00:00,2023-11-29 16:39:35.943925200+00:00,240,,Echo
34,high demand of: iPhone 11 Pro,hd,1772,2023-11-28 16:38:28.119158845+00:00,2023-11-29 16:39:35.943925200+00:00,240,,iPhone 11 Pro
35,high demand of: Kindle Paperwhite,hd,1948,2023-11-28 16:38:28.119158845+00:00,2023-11-29 16:39:35.943925200+00:00,240,,Kindle Paperwhite
36,high demand of: MacBook Pro,hd,1831,2023-11-28 16:38:28.119158845+00:00,2023-11-29 16:39:35.943925200+00:00,240,,MacBook Pro
37,high demand of: iPad mini,hd,1707,2023-11-28 16:38:28.119158845+00:00,2023-11-29 16:39:35.943925200+00:00,240,,iPad mini
38,high demand of: Fire Stick,hd,2045,2023-11-28 16:38:28.119158845+00:00,2023-11-29 16:39:35.943925200+00:00,240,,Fire Stick
39,high demand of: iPad Pro,hd,1945,2023-11-28 16:38:28.119158845+00:00,2023-11-29 16:39:35.943925200+00:00,240,,iPad Pro
40,high demand of: iPhone 8,hd,1901,2023-11-28 16:38:28.119158845+00:00,2023-11-29 16:39:35.943925200+00:00,240,,iPhone 8
41,high demand of: iPhone X,hd,1964,2023-11-28 16:38:28.119158845+00:00,2023-11-29 16:39:35.943925200+00:00,240,,iPhone X
42,high demand of: Echo Dot,hd,1820,2023-11-28 16:38:28.119158845+00:00,2023-11-29 16:39:35.943925200+00:00,240,,Echo Dot
43,high demand of: Echo Show 8,hd,1883,2023-11-28 16:38:28.119158845+00:00,2023-11-29 16:39:35.943925200+00:00,240,,Echo Show 8
44,high demand of: Fire Stick 4K,hd,1877,2023-11-28 16:38:28.119158845+00:00,2023-11-29 16:39:35.943925200+00:00,240,,Fire Stick 4K
45,high demand of: Echo Studio,hd,1857,2023-11-28 16:38:28.119158845+00:00,2023-11-29 16:39:35.943925200+00:00,240,,Echo Studio
46,high demand of: MacBook Air,hd,1857,2023-11-28 16:38:28.119158845+00:00,2023-11-29 16:39:35.943925200+00:00,240,,MacBook Air
47,high demand of: iPad Air,hd,1958,2023-11-28 16:38:28.119158845+00:00,2023-11-29 16:39:35.943925200+00:00,240,,iPad Air
48,high demand of: Echo Show 5,hd,1790,2023-11-28 16:38:28.119158845+00:00,2023-11-29 16:39:35.943925200+00:00,240,,Echo Show 5
49,high demand of: iPad,hd,1775,2023-11-28 16:38:28.119158845+00:00,2023-11-29 16:39:35.943925200+00:00,240,,iPad
50,high demand of: iPhone 11,hd,1676,2023-11-28 16:38:28.119158845+00:00,2023-11-29 16:39:35.943925200+00:00,240,,iPhone 11
51,high demand of: Echo Plus,hd,1842,2023-11-28 16:38:28.119158845+00:00,2023-11-29 16:39:35.943925200+00:00,240,,Echo Plus
52,high demand of: Kindle,hd,1553,2023-11-28 16:38:28.119158845+00:00,2023-11-29 16:39:35.943925200+00:00,240,,Kindle
53,high load of object type items,hl,40949,2023-11-28 16:38:28.119158845+00:00,2023-11-29 16:39:35.943925200+00:00,240,,items
54,high load of object type orders,hl,4271,2023-11-28 16:38:28.119158845+00:00,2023-11-29 16:39:35.943925200+00:00,240,,orders
55,high load of object type packages,hl,2429,2023-11-28 16:38:28.119158845+00:00,2023-11-29 16:39:35.943925200+00:00,240,,packages
56,high load (over all object types),hol,14022,2023-11-28 16:38:28.119158845+00:00,2023-11-29 16:39:35.943925200+00:00,240,,
